{
  "id": "battlefield:dynasty-warriors-8-chi-bi",
  "display_name": "Battle of Chi Bi",
  "aliases": [
    "Battle of Red Cliffs"
  ],
  "game_id": "game:dynasty-warriors-8",
  "canonical_battle_slug": "chi-bi",
  "canonical_battle_name": "Battle of Chi Bi",
  "historical_year": 208,
  "mode": "story",
  "route": "historical",
  "playable_faction_ids": [
    "faction:wei",
    "faction:shu",
    "faction:wu"
  ],
  "objectives": [
    {
      "kind": "primary",
      "description": "Break the opposing fleet's formation.",
      "spoiler_level": "none"
    },
    {
      "kind": "hidden",
      "description": "Meeting the route conditions redirects the campaign away from the historical outcome.",
      "spoiler_level": "major"
    }
  ],
  "recurrence_of": "battlefield:dynasty-warriors-3-chi-bi",
  "appearances": [
    {
      "game_id": "game:dynasty-warriors-8",
      "role": "story_only"
    }
  ],
  "summary": {
    "blocks": [
      {
        "spoiler_level": "none",
        "text": "The same battle restaged with branching route support, which is why it links back to the earlier record rather than duplicating it.",
        "language": "en"
      }
    ]
  },
  "tags": [
    "naval",
    "recurring",
    "branching-route"
  ],
  "provenance": {
    "category": "community_observation",
    "contributor": "musoudb_seed",
    "contributed_at": "2026-08-03T00:00:00Z",
    "sources": [
      {
        "kind": "in_game_observation",
        "citation": "Verified by a contributor during play; see revision history."
      }
    ]
  },
  "meta": {
    "schema_version": "0",
    "revision": 1,
    "created_at": "2026-08-03T00:00:00Z",
    "updated_at": "2026-08-03T00:00:00Z",
    "status": "accepted"
  }
}
