{
  "id": "battlefield:dynasty-warriors-3-chi-bi",
  "display_name": "Battle of Chi Bi",
  "aliases": [
    "Battle of Red Cliffs",
    "Chibi"
  ],
  "game_id": "game:dynasty-warriors-3",
  "canonical_battle_slug": "chi-bi",
  "canonical_battle_name": "Battle of Chi Bi",
  "historical_year": 208,
  "mode": "story",
  "playable_faction_ids": [
    "faction:wei",
    "faction:shu",
    "faction:wu"
  ],
  "objectives": [
    {
      "kind": "primary",
      "description": "Break the opposing fleet's formation.",
      "spoiler_level": "none"
    },
    {
      "kind": "secondary",
      "description": "Survive the fire attack phase.",
      "spoiler_level": "minor"
    }
  ],
  "appearances": [
    {
      "game_id": "game:dynasty-warriors-3",
      "role": "story_only"
    }
  ],
  "summary": {
    "blocks": [
      {
        "spoiler_level": "none",
        "text": "The naval engagement at Red Cliffs, and the single most reused set piece in the franchise.",
        "language": "en"
      },
      {
        "spoiler_level": "minor",
        "text": "The stage is structured around a scripted fire attack that changes the map partway through.",
        "language": "en",
        "scope_game_ids": [
          "game:dynasty-warriors-3"
        ]
      }
    ]
  },
  "tags": [
    "naval",
    "recurring",
    "signature-battle"
  ],
  "provenance": {
    "category": "community_observation",
    "contributor": "musoudb_seed",
    "contributed_at": "2026-08-03T00:00:00Z",
    "sources": [
      {
        "kind": "in_game_observation",
        "citation": "Verified by a contributor during play; see revision history."
      }
    ]
  },
  "meta": {
    "schema_version": "0",
    "revision": 1,
    "created_at": "2026-08-03T00:00:00Z",
    "updated_at": "2026-08-03T00:00:00Z",
    "status": "accepted"
  }
}
